{"absolutePath":"/srv/bgmss-ops-validation","gitOid":"3f585cfe0a0dd61fe783a839528fef25470a58db","imageReference":"prom/prometheus:v3.13.1-distroless@sha256:aaaaaaaaaaaaaaaaaaaaaaaaaaaaaaaaaaaaaaaaaaaaaaaaaaaaaaaaaaaaaaaa","relativePath":"evidence/result.json","schemaVersion":"foundation-boundaries-v1","sha256":"sha256:aaaaaaaaaaaaaaaaaaaaaaaaaaaaaaaaaaaaaaaaaaaaaaaaaaaaaaaaaaaaaaaa"}
